{
  "printPlan": "1.0",
  "generatedAt": "2026-09-13T14:53:52.465Z",
  "source": {
    "annotation": "us.irs.1040-schedule-c:2025@1.0.0",
    "inheritedFrom": [],
    "form": {
      "number": "1040-SCHEDULE-C",
      "taxYear": 2025,
      "revision": "2025-04-03"
    },
    "media": {
      "uri": "https://www.irs.gov/pub/irs-pdf/f1040sc.pdf",
      "sha256": "ddf401dbe060467d39f90ad2abf645df1de31512821a150dc68a3882bbf19716"
    }
  },
  "profile": null,
  "instance": {
    "path": "$.schedules.scheduleC",
    "index": 1,
    "count": 2
  },
  "units": "pt",
  "pages": [
    {
      "index": 0,
      "width": 612,
      "height": 792,
      "origin": "top-left",
      "ops": [
        {
          "op": "text",
          "fieldId": "proprietor.name",
          "text": "DANIEL R WHITFIELD",
          "x": 39,
          "baseline": 104.231,
          "width": 92.511,
          "font": "Helvetica",
          "size": 9,
          "scale": 1,
          "color": "#000000",
          "letterSpacing": 0,
          "align": "left",
          "rotate": 0
        },
        {
          "op": "text",
          "fieldId": "proprietor.ssn",
          "text": "412-55-7801",
          "x": 449.4,
          "baseline": 103.731,
          "width": 51.03,
          "font": "Helvetica",
          "size": 9,
          "scale": 1,
          "color": "#000000",
          "letterSpacing": 0,
          "align": "left",
          "rotate": 0
        },
        {
          "op": "text",
          "fieldId": "business.principalActivity",
          "text": "FREELANCE PHOTOGRAPHY AND WRITING",
          "x": 39,
          "baseline": 128.231,
          "width": 189.522,
          "font": "Helvetica",
          "size": 9,
          "scale": 1,
          "color": "#000000",
          "letterSpacing": 0,
          "align": "left",
          "rotate": 0
        },
        {
          "op": "text",
          "fieldId": "business.code#c0",
          "text": "5",
          "x": 465.498,
          "baseline": 128.731,
          "width": 5.004,
          "font": "Helvetica",
          "size": 9,
          "scale": 1,
          "color": "#000000",
          "letterSpacing": 0,
          "align": "center",
          "rotate": 0
        },
        {
          "op": "text",
          "fieldId": "business.code#c1",
          "text": "4",
          "x": 479.898,
          "baseline": 128.731,
          "width": 5.004,
          "font": "Helvetica",
          "size": 9,
          "scale": 1,
          "color": "#000000",
          "letterSpacing": 0,
          "align": "center",
          "rotate": 0
        },
        {
          "op": "text",
          "fieldId": "business.code#c2",
          "text": "1",
          "x": 494.298,
          "baseline": 128.731,
          "width": 5.004,
          "font": "Helvetica",
          "size": 9,
          "scale": 1,
          "color": "#000000",
          "letterSpacing": 0,
          "align": "center",
          "rotate": 0
        },
        {
          "op": "text",
          "fieldId": "business.code#c3",
          "text": "9",
          "x": 508.698,
          "baseline": 128.731,
          "width": 5.004,
          "font": "Helvetica",
          "size": 9,
          "scale": 1,
          "color": "#000000",
          "letterSpacing": 0,
          "align": "center",
          "rotate": 0
        },
        {
          "op": "text",
          "fieldId": "business.code#c4",
          "text": "2",
          "x": 523.098,
          "baseline": 128.731,
          "width": 5.004,
          "font": "Helvetica",
          "size": 9,
          "scale": 1,
          "color": "#000000",
          "letterSpacing": 0,
          "align": "center",
          "rotate": 0
        },
        {
          "op": "text",
          "fieldId": "business.code#c5",
          "text": "0",
          "x": 537.498,
          "baseline": 128.731,
          "width": 5.004,
          "font": "Helvetica",
          "size": 9,
          "scale": 1,
          "color": "#000000",
          "letterSpacing": 0,
          "align": "center",
          "rotate": 0
        },
        {
          "op": "text",
          "fieldId": "business.name",
          "text": "MERIDIAN FIELD NOTES",
          "x": 39,
          "baseline": 152.231,
          "width": 105.516,
          "font": "Helvetica",
          "size": 9,
          "scale": 1,
          "color": "#000000",
          "letterSpacing": 0,
          "align": "left",
          "rotate": 0
        },
        {
          "op": "text",
          "fieldId": "business.address",
          "text": "1487 MERIDIAN WAY",
          "x": 233.4,
          "baseline": 165.231,
          "width": 89.523,
          "font": "Helvetica",
          "size": 9,
          "scale": 1,
          "color": "#000000",
          "letterSpacing": 0,
          "align": "left",
          "rotate": 0
        },
        {
          "op": "text",
          "fieldId": "business.cityStateZip",
          "text": "CEDAR PARK, TX 78613",
          "x": 233.4,
          "baseline": 177.231,
          "width": 102.537,
          "font": "Helvetica",
          "size": 9,
          "scale": 1,
          "color": "#000000",
          "letterSpacing": 0,
          "align": "left",
          "rotate": 0
        },
        {
          "op": "text",
          "fieldId": "accountingMethod[CASH]",
          "text": "X",
          "x": 170.466,
          "baseline": 189.513,
          "width": 4.669,
          "font": "Helvetica",
          "size": 7,
          "scale": 1,
          "color": "#000000",
          "letterSpacing": 0,
          "align": "center",
          "rotate": 0
        },
        {
          "op": "text",
          "fieldId": "materiallyParticipated[true]",
          "text": "X",
          "x": 516.065,
          "baseline": 200.513,
          "width": 4.669,
          "font": "Helvetica",
          "size": 7,
          "scale": 1,
          "color": "#000000",
          "letterSpacing": 0,
          "align": "center",
          "rotate": 0
        },
        {
          "op": "text",
          "fieldId": "madeReportablePayments[false]",
          "text": "X",
          "x": 552.065,
          "baseline": 224.513,
          "width": 4.669,
          "font": "Helvetica",
          "size": 7,
          "scale": 1,
          "color": "#000000",
          "letterSpacing": 0,
          "align": "center",
          "rotate": 0
        },
        {
          "op": "text",
          "fieldId": "line1",
          "text": "24,800",
          "x": 543.478,
          "baseline": 273.231,
          "width": 27.522,
          "font": "Helvetica",
          "size": 9,
          "scale": 1,
          "color": "#000000",
          "letterSpacing": 0,
          "align": "right",
          "rotate": 0
        },
        {
          "op": "text",
          "fieldId": "line3",
          "text": "24,800",
          "x": 543.478,
          "baseline": 297.231,
          "width": 27.522,
          "font": "Helvetica",
          "size": 9,
          "scale": 1,
          "color": "#000000",
          "letterSpacing": 0,
          "align": "right",
          "rotate": 0
        },
        {
          "op": "text",
          "fieldId": "line5",
          "text": "24,800",
          "x": 543.478,
          "baseline": 321.231,
          "width": 27.522,
          "font": "Helvetica",
          "size": 9,
          "scale": 1,
          "color": "#000000",
          "letterSpacing": 0,
          "align": "right",
          "rotate": 0
        },
        {
          "op": "text",
          "fieldId": "line7",
          "text": "24,800",
          "x": 543.478,
          "baseline": 345.231,
          "width": 27.522,
          "font": "Helvetica",
          "size": 9,
          "scale": 1,
          "color": "#000000",
          "letterSpacing": 0,
          "align": "right",
          "rotate": 0
        },
        {
          "op": "text",
          "fieldId": "line8",
          "text": "480",
          "x": 274.388,
          "baseline": 369.231,
          "width": 15.012,
          "font": "Helvetica",
          "size": 9,
          "scale": 1,
          "color": "#000000",
          "letterSpacing": 0,
          "align": "right",
          "rotate": 0
        },
        {
          "op": "text",
          "fieldId": "line9",
          "text": "1,240",
          "x": 266.882,
          "baseline": 393.231,
          "width": 22.518,
          "font": "Helvetica",
          "size": 9,
          "scale": 1,
          "color": "#000000",
          "letterSpacing": 0,
          "align": "right",
          "rotate": 0
        },
        {
          "op": "text",
          "fieldId": "line13",
          "text": "2,100",
          "x": 266.882,
          "baseline": 465.231,
          "width": 22.518,
          "font": "Helvetica",
          "size": 9,
          "scale": 1,
          "color": "#000000",
          "letterSpacing": 0,
          "align": "right",
          "rotate": 0
        },
        {
          "op": "text",
          "fieldId": "line18",
          "text": "615",
          "x": 555.988,
          "baseline": 369.231,
          "width": 15.012,
          "font": "Helvetica",
          "size": 9,
          "scale": 1,
          "color": "#000000",
          "letterSpacing": 0,
          "align": "right",
          "rotate": 0
        },
        {
          "op": "text",
          "fieldId": "line22",
          "text": "1,385",
          "x": 548.482,
          "baseline": 441.231,
          "width": 22.518,
          "font": "Helvetica",
          "size": 9,
          "scale": 1,
          "color": "#000000",
          "letterSpacing": 0,
          "align": "right",
          "rotate": 0
        },
        {
          "op": "text",
          "fieldId": "line24a",
          "text": "2,260",
          "x": 548.482,
          "baseline": 477.231,
          "width": 22.518,
          "font": "Helvetica",
          "size": 9,